nama_kos,jenis_kos,area,kota_cln,price_cln_max,facility_score
Kost Exclusive Menoreh Gajahmungkur Semarang,putri,gajahmungkur,semarang,1500000,6
Kost Indriyono Tipe C1 Gajahmungkur Semarang,putri,gajahmungkur,semarang,800000,2
Kost Indriyono Tipe B Gajahmungkur Semarang,putri,gajahmungkur,semarang,700000,2
Kost Indriyono Tipe C2 Gajahmungkur Semarang,putri,gajahmungkur,semarang,1200000,2
Kost Kasih Gajahmungkur Semarang,putri,gajahmungkur,semarang,450000,4
Kost Andalus MenorehUtara Gajahmungkur Semarang,putri,gajahmungkur,semarang,550000,2
Kost Sampangan Tipe C Gajahmungkur Semarang,campur,gajahmungkur,semarang,600000,4
Kost Lamongan  Gajahmungkur Semarang,campur,gajahmungkur,semarang,650000,0
Kost Menoreh Timur Tipe B Gajahmungkur Semarang,campur,gajahmungkur,semarang,650000,4
Kost Bu Siane Tipe A Gajahmungkur Semarang,putra,gajahmungkur,semarang,450000,2
Kost Menoreh Dua Satu Tipe B Sampangan Gajahmungkur Semarang,putri,gajahmungkur,semarang,450000,2
Kost Putri Menoreh Dua Satu Sampangan Semarang,putri,gajahmungkur,semarang,500000,2
Kost Nanda Ngaliyan Semarang,putra,ngaliyan,semarang,600000,2
Kost Uti Menoreh Sampangan Gajahmungkur Semarang,putri,gajahmungkur,semarang,450000,4
Kost Griya Stonen Tipe A Gajahmungkur Semarang,campur,gajahmungkur,semarang,1500000,4
Kost Fitria Gajahmungkur Semarang,putra,gajahmungkur,semarang,300000,0
Kost D'bay 2 Banyumanik Semarang,putri,banyumanik,semarang,1500000,6
Kost Griya Sawunggaling Tipe A Banyumanik Semarang,putra,banyumanik,semarang,750000,2
Kost Paviliun Durian Executive Room Banyumanik Semarang,putri,banyumanik,semarang,1700000,6
Kost Mangga Dalam Selatan Banyumanik Semarang,campur,banyumanik,semarang,900000,4
Kost  ACE Tipe B Banyumanik Semarang,campur,banyumanik,semarang,1000000,2
Kost Bapak Sukarmin Tipe B Banyumanik Semarang,campur,banyumanik,semarang,400000,2
Kost Syariah Poltekes Srondol Wetan Banyumanik Semarang,putri,banyumanik,semarang,2600000,6
Kost Pandu Tipe A Pedurungan Semarang,campur,pedurungan,semarang,750000,4
Kost Pandu 12 Tipe B Pedurungan Semarang,campur,pedurungan,semarang,1200000,2
Kost Nugroho Tipe B Pedurungan Semarang,campur,pedurungan,semarang,1000000,4
Kost Nugroho Tipe A Pedurungan Semarang,campur,pedurungan,semarang,700000,4
Kost Pak Jumangi Pedurungan Semarang,campur,pedurungan,semarang,600000,4
Kost Bu Ratimah Pedurungan Semarang,campur,pedurungan,semarang,600000,2
Kost Bu Siti Tlogosari Pedurungan Semarang,campur,pedurungan,semarang,700000,0
Kost Tlogosari Pedurungan Semarang,putra,pedurungan,semarang,400000,4
Kost Didit Pedurungan Semarang,campur,pedurungan,semarang,550000,4
Kost Bintang Tipe A Tembalang Semarang,campur,tembalang,semarang,550000,4
Kost Regganet Tembalang Semarang,campur,tembalang,semarang,600000,4
Kost Mbak Nia Tipe A Pedurungan Semarang,campur,pedurungan,semarang,500000,2
Kost Mbak Nia Tipe B Pedurungan Semarang,campur,pedurungan,semarang,550000,2
Kost Mbak Nia Tipe C Pedurungan Semarang,campur,pedurungan,semarang,600000,2
Kost Kembar 27 Pedurungan Semarang,campur,pedurungan,semarang,600000,4
Kost Syariah Pasutri Pedurungan Semarang,campur,pedurungan,semarang,1350000,0
Kost Harian Pondok Pakde Pen Pedurungan Semarang,campur,pedurungan,semarang,850000,4
Kost Pondok Pakde Pen Tipe C Pedurungan Semarang,campur,pedurungan,semarang,850000,2
Kost Omah Joglo Gajahmungkur Semarang,campur,gajahmungkur,semarang,1750000,2
Kost Bu Siska Gajahmungkur Semarang,campur,gajahmungkur,semarang,700000,4
Kost De Ghazlina Gajahmungkur Semarang,putri,gajahmungkur,semarang,750000,4
Kost Bapak Sarono Tipe A Gajahmungkur Semarang,putra,gajahmungkur,semarang,400000,2
Kost Bapak Endra Gajahmungkur Semarang,campur,gajahmungkur,semarang,650000,2
Kost Wisma Idea Gajahmungkur Semarang,campur,gajahmungkur,semarang,1200000,2
Kost Pak Mudjiono Singosari Malang,campur,singosari,malang,425000,4
Kost Biru 2 Singosari Malang,putra,singosari,malang,400000,2
Kost Karanglo 19C Tipe B Singosari Malang,putra,singosari,malang,425000,2
Kost Angker Singosari Malang,putra,singosari,malang,400000,2
Kost Ibu Tutik Singosari Malang,campur,singosari,malang,400000,0
Kost Putra Mondoroko Singosari Malang,putra,singosari,malang,300000,0
Kost Jl. Suropati Singosari Malang,putra,singosari,malang,350000,2
Kost Bapak Mukaji Singosari Malang,putra,singosari,malang,450000,0
Kost P Tohir Sempol Singosari Malang,putra,singosari,malang,225000,2
Kost Karanglo Singosari Malang,putra,singosari,malang,350000,4
Kost Toko Jaya Abadi Tipe A Singosari Malang,campur,singosari,malang,350000,4
Kost Toko Jaya Abadi Tipe B Singosari Malang,campur,singosari,malang,550000,4
Kost Tunjungtirto Singosari Malang,putra,singosari,malang,250000,2
Kost Karolin Blimbing Malang,campur,blimbing,malang,1500000,6
Kost  54B Singosari Malang,putra,singosari,malang,450000,4
Kost Berkah Singosari Malang,putri,singosari,malang,550000,2
Kost Putra Manggar Tipe C Lowokwaru Malang,putra,lowokwaru,malang,500000,4
Kost Ratu Boarding House Tipe A Klojen Malang,putri,klojen,malang,2500000,6
Kost Ratu Boarding House Tipe B Klojen Malang,putra,klojen,malang,2500000,6
Kost Grand ABM Lowokwaru Malang,campur,lowokwaru,malang,1400000,4
Kost Bu Nur Lowokwaru Malang,putri,lowokwaru,malang,450000,2
Kost Gajayana Lowokwaru Malang,putri,lowokwaru,malang,500000,4
Kost Bantaran IIID Lowokwaru Malang,putra,lowokwaru,malang,500000,2
Kost Muslim Dwiga Lowokwaru Malang,putra,lowokwaru,malang,750000,4
Kost Jalan Kendalsari no 41 Lowokwaru Malang,putri,lowokwaru,malang,500000,2
Kost D'Maktab Homestay Lowokwaru Malang,campur,lowokwaru,malang,2500000,6
Kost LiSanda Lowokwaru Malang,putra,lowokwaru,malang,850000,2
Kost Semanggi Barat Tipe B Lowokwaru Malang,putri,lowokwaru,malang,450000,2
Kost Semanggi Barat Tipe A Lowokwaru Malang,putri,lowokwaru,malang,400000,2
Kost Matahari Lowokwaru Malang,putri,lowokwaru,malang,500000,2
Kost Gandrung Lowokwaru Malang,putri,lowokwaru,malang,750000,4
Kost Iin Tipe B Lowokwaru Malang,putra,lowokwaru,malang,800000,4
Kost Kamar Mandi Dalam Kalpataru 65 Lowokwaru Malang,putra,lowokwaru,malang,800000,6
Kost Kalpataru 65 Lowokwaru Malang,putra,lowokwaru,malang,600000,4
Kostan Putra Pagarra Syariah Tipe A Lowokwaru Malang,putra,lowokwaru,malang,1000000,6
Kost 249A Lowokwaru Malang,putri,lowokwaru,malang,500000,2
Kost N'Cafe A'isy Dhasyad Kepanjen Malang,campur,kepanjen,malang,600000,6
Kost Putri Bu Sarni Kepanjen Malang,putri,kepanjen,malang,350000,4
Kost LG Homestay Kepanjen Malang,campur,kepanjen,malang,650000,6
Kost Laos Kepanjen Malang,putra,kepanjen,malang,500000,4
Kost Al-Qodri Kepanjen Malang,campur,kepanjen,malang,400000,0
Kost Karyawan Kepanjen Malang,putra,kepanjen,malang,800000,4
Kost Adisantuso 20 Kepanjen Malang,putra,kepanjen,malang,600000,6
Kost Ibu Titis Tipe A Kepanjen Malang,putri,kepanjen,malang,300000,2
Kost Griya Panji Kepanjen Malang,putri,kepanjen,malang,350000,4
Kost Kepanjen Fariyana Kepanjen Malang,putra,kepanjen,malang,600000,6
Kost Barokah Tipe B Kepanjen Malang,putra,kepanjen,malang,500000,6
Kost Barokah Tipe A Kepanjen Malang,putra,kepanjen,malang,450000,4
Kost Buk Maning Kepanjen  Malang,campur,kepanjen,malang,500000,4
Kost Ibu Soes Tipe A Kepanjen Malang,putri,kepanjen,malang,450000,4
Kost Ibu Soes Tipe B Kepanjen Malang,putri,kepanjen,malang,500000,6
Kost Al Amin Kepanjen Malang,putri,kepanjen,malang,500000,2
Kost Ibu Titis Tipe B Kepanjen Malang,putri,kepanjen,malang,350000,4
Kost Asri Kepanjen Malang,campur,kepanjen,malang,600000,6
Kost Putri Muslim Kertopamuji 6 Lowokwaru Malang,putri,lowokwaru,malang,700000,2
Kost Kav 26 Lowokwaru Malang,putri,lowokwaru,malang,800000,4
Kost Terusan Surabaya Blok-A No.14-G Lowokwaru Malang,putri,lowokwaru,malang,850000,6
Kost Sumbersari 3-A 224 Lowokwaru Malang,putri,lowokwaru,malang,600000,4
Kost Mantika Lowokwaru Malang,putri,lowokwaru,malang,900000,6
Kost Adea Sukun Malang,putri,sukun,malang,950000,4
Kost Putri Kalijaga Lowokwaru Malang,putri,lowokwaru,malang,950000,6
Kost Andy Jaya Lowokwaru Malang,putra,lowokwaru,malang,400000,2
Kost Andy Jaya Panjaitan Klojen Malang,putri,klojen,malang,425000,2
Kost Dasti Sukun Malang,putri,sukun,malang,1000000,6
Kost Sumbersari VI/16 Tipe A Lowokwaru Malang,putra,lowokwaru,malang,600000,4
Kost Sumbersari 4/60B Lowokwaru Kota Malang,putri,lowokwaru,malang,600000,0
Kost Ruko Bening SIgura Gura Malang,putra,lowokwaru,malang,600000,2
Kost Pak Kusno Sukun Malang,putra,sukun,malang,700000,6
Kost Sumbersari Tipe C Lowokwaru Malang,putra,lowokwaru,malang,500000,2
Kost Muslimah Nawangan Lowokwaru Malang,putri,lowokwaru,malang,550000,2
Kost Wadas Lintang Tipe A Lowokwaru Malang,putri,lowokwaru,malang,350000,4
Kost Devy Lowokwaru Malang,putri,lowokwaru,malang,700000,2
Kost Ibu Titi 2 Batu Malang,campur,batu,malang,350000,2
Kost Afiasari Batu Malang,putra,batu,malang,500000,2
Kost White Batu,campur,batu,malang,500000,4
Kost Sakura Pesanggrahan Batu,campur,batu,malang,750000,6
Kost Pak Warisin Tipe B Batu Malang,campur,batu,malang,600000,4
Kost Raya Pattimura 37 Batu,putra,batu,malang,2000000,6
Kost Griya Syafa Batu Malang,putri,batu,malang,420000,4
Kost Pak To Soto I Batu,campur,batu,malang,450000,4
Kost Samadi Tipe D Batu,putri,batu,malang,700000,4
Kost Samadi Tipe A Batu,putri,batu,malang,400000,2
Kost Samadi Tipe B Batu,putri,batu,malang,500000,4
Kost Samadi Tipe C Batu,putri,batu,malang,600000,4
Kost Jalan Wukir Batu Malang,putra,batu,malang,400000,4
Kost Chimoen Batu,putri,batu,malang,400000,4
Kost L Jl. Suropati Gang Karate Batu,campur,batu,malang,750000,6
Kost Abah Heru Batu Premium Batu Malang,campur,batu,malang,750000,4
Kost Pak Warisin Tipe A Batu Malang,campur,batu,malang,375000,2
Kost Nonalisa Boarding House Sukun Malang,putri,sukun,malang,500000,0
Kost Srikandi Sukun Malang,putri,sukun,malang,300000,4
Kost Jl Simpang Kepuh Utara Sukun Malang,campur,sukun,malang,750000,6
Kost 3 Dara Tipe C Sukun Malang,putri,sukun,malang,1000000,2
Kost 3 Dara Tipe D Sukun Malang,putri,sukun,malang,1250000,2
Kost 3 Dara Tipe E Sukun Malang,putri,sukun,malang,1400000,2
Kost 3 Dara Tipe B Sukun Malang,putri,sukun,malang,900000,2
Kost 3 Dara Tipe A Sukun Malang,putri,sukun,malang,700000,2
Kost Nonalisa Sukun Malang,putri,sukun,malang,1000000,2
Kost Barokah Sukun Malang,putra,sukun,malang,450000,6
Kost Vfaeyfa Sukun Malang,putri,sukun,malang,530000,0
Kost Bu Indah Sukun Malang,putra,sukun,malang,500000,6
Kost Indah Janti Sukun Malang,putri,sukun,malang,700000,4
Kost Janti Sukun Malang,putra,sukun,malang,500000,4
Kost Merpati Sukun Malang,putri,sukun,malang,600000,6
Kost University Park Sukun Malang,putri,sukun,malang,500000,2
Kost Omah Mas Ozi Tipe B Klojen Malang,putri,klojen,malang,450000,4
Kost Griya Tipe C Sukun Malang,putri,sukun,malang,550000,4
Kost Griya Putri Sukun Malang,putri,sukun,malang,900000,6
Kost Total Sukun Malang,putra,sukun,malang,450000,4
Kost Fortuna Blimbing Malang,putra,blimbing,malang,850000,6
Kost Karyawan Eksklusif Blimbing Malang,putra,blimbing,malang,1500000,6
Kost Putri Kak Mella. Jln. Karya Timur Glintung Gang 4 No.63 Blimbing Malang,putri,blimbing,malang,450000,2
Kost Btari House Tipe B Blimbing Malang,campur,blimbing,malang,600000,4
Kost LA Sucipto 57A Tipe A Blimbing Malang,putri,blimbing,malang,600000,4
Kost LA Sucipto 57A Tipe B Blimbing Malang,putri,blimbing,malang,650000,4
Kost Borobudur IVB/9 Blimbing Malang,putri,blimbing,malang,400000,0
Kost Cimadur Tipe B Blimbing Malang,putra,blimbing,malang,750000,4
Kost Ibu Rani Tipe B Blimbing Malang,putri,blimbing,malang,700000,2
Kost Ibu Rani Tipe A Blimbing Malang,putri,blimbing,malang,400000,2
Kost Murah Tipe A Blimbing Malang,putri,blimbing,malang,350000,0
Kost Murah Tipe C Blimbing Malang,putri,blimbing,malang,550000,2
Kost Putri Ripin Lowokwaru Malang,putri,lowokwaru,malang,600000,6
Kost Sumbersari Gang 3 229A Tipe B Lowokwaru Malang,putri,lowokwaru,malang,900000,4
Kost Sumbersari  254A Tipe A Lowokwaru Malang,putri,lowokwaru,malang,750000,2
Kost Sumbersari  254A Tipe B Lowokwaru Malang,putri,lowokwaru,malang,800000,2
Kost Sumbersari Gang 3 229A Tipe A Lowokwaru Malang,putri,lowokwaru,malang,800000,0
Kost Sumbersari Gang 3 229A Tipe C Lowokwaru Malang,putri,lowokwaru,malang,1800000,4
Kost Pak Tohir Tipe B Lowokwaru Malang,putri,lowokwaru,malang,580000,2
Kost Pak Tohir Tipe A Lowokwaru Malang,putri,lowokwaru,malang,700000,2
Kost UB Bunga Matahari Lowokwaru Malang,putri,lowokwaru,malang,1300000,6
Kost Omakost Dieng Tipe A Sukun Malang,putra,sukun,malang,550000,4
Kost Bu Fitri Sukun Malang,putri,sukun,malang,650000,0
Kost Prabawira Klojen Malang,putri,klojen,malang,1000000,4
Kost Putri Ibu Yeni Candi 2 Tipe A Sukun Malang,putri,sukun,malang,650000,6
Kost Sumbersari VI/16 Tipe B Lowokwaru Malang,putra,lowokwaru,malang,600000,4
Kost Candi Badut 231 Sukun Malang,putri,sukun,malang,500000,6
Kost Bu Ali Jalan Mayjen Panjaitan Malang,putri,klojen,malang,450000,4
Kost Putri Athalia Tipe A Sukun Malang,putri,sukun,malang,500000,4
Kost Jln Kembang Kertas Tipe A Lowokwaru Malang,putra,lowokwaru,malang,900000,6
Kost PW Lowokwaru Malang,putri,lowokwaru,malang,850000,2
Kost Bu Aisyah Lowokwaru Malang,putra,lowokwaru,malang,500000,6
Kost Putri Keramik Dinoyo Malang,putri,lowokwaru,malang,416000,4
Kost Putri Pakpin Dinoyo Malang,putri,lowokwaru,malang,416000,4
Kost Dinoyo Permai Tipe C Lowokwaru Malang,putra,lowokwaru,malang,600000,4
Kost Suhat Putri Lowokwaru Malang,putri,lowokwaru,malang,900000,6
Kost Jl Taman Bunga Merak Lowokwaru Malang,putra,lowokwaru,malang,850000,6
Kost Putra Ibu Ida Candi Mendut Lowokwaru Malang,putra,lowokwaru,malang,800000,6
Kost Putra Ibu Ida Kendalsari Lowokwaru Malang,putra,lowokwaru,malang,600000,4
Kost Griya Shanta C-273 Lowokwaru Malang,putri,lowokwaru,malang,650000,6
Kost Divyanisa Lowokwaru Malang,putri,lowokwaru,malang,1500000,4
Kost TWKA 32 Lowokwaru Malang,putri,lowokwaru,malang,900000,4
Kost Bu Yudi Griyashanta Tipe C Lowokwaru Malang,putra,lowokwaru,malang,1250000,4
Kost Bu Yudi Griyashanta Tipe A Lowokwaru Malang,putra,lowokwaru,malang,900000,2
Kost Griya Asma Tipe B Lowokwaru Malang,putri,lowokwaru,malang,550000,4
Kost Cozy Putra Lowokwaru Malang,putra,lowokwaru,malang,1400000,6
